{
  "ManifestVersion": "cw-m5-026b-source-account-repair-authorization-v1",
  "ApprovalId": "CW-M5-026B-SOURCE-ACCOUNT-REPAIR-20261014-001",
  "ApprovedAtUtc": "2026-10-14T21:45:30.340545Z",
  "ExpiresAtUtc": "2026-10-14T22:45:30.340545Z",
  "Operator": {
    "User": "cdjensen94",
    "Uid": 1000
  },
  "Host": {
    "HostName": "christian-laptop",
    "Runtime": "Podman",
    "Rootless": true
  },
  "Target": {
    "ContainerName": "continuumwiki-m5-026b-source-ro1",
    "ContainerId": "6a4d4f8707ee4f5b14dddfff183db6d26ce7453eaba377b7c9d081bc1157f914",
    "ImageReference": "docker.io/library/mariadb@sha256:6422478cb8e159f080fb1d8ccf65101e26fe51385787fde7d16c3b165a331f15",
    "ProvisioningRunId": "20261012T093746Z-86380",
    "VolumeName": "continuumwiki-m5-026b-source-ro1-data",
    "DatabaseName": "cw_m5_026b_source_ro1",
    "DatabaseIdentity": "continuumwiki_m5_026b_source_app",
    "AccountHost": "%",
    "Endpoint": "127.0.0.1:13326",
    "CredentialDirectory": "/home/cdjensen94/.local/state/continuumwiki/cw-m5-026b/source-ro1",
    "ApplicationCredentialFile": "/home/cdjensen94/.local/state/continuumwiki/cw-m5-026b/source-ro1/application.env",
    "ClientOptionFile": "/home/cdjensen94/.local/state/continuumwiki/cw-m5-026b/source-ro1/inspection-client.cnf"
  },
  "Operations": {
    "InspectExactSource": true,
    "ReadOnlyAccountPrechecks": true,
    "CreateExactAccountIfAbsent": true,
    "GrantExactSchemaPrivileges": true,
    "VerifyExactGrantSet": true,
    "VerifyAuthenticatedTcpIdentity": true,
    "DestinationAccess": false,
    "ContainerLifecycle": false,
    "CredentialModification": false,
    "DataOrSchemaChanges": false,
    "Migrations": false,
    "Backup": false,
    "Restore": false,
    "ProductionAccess": false
  },
  "Evidence": {
    "Directory": "/home/cdjensen94/Projects/ContinuumWiki.NET/secure/evidence/cw-m5-026b-source-account-repair-CW-M5-026B-SOURCE-ACCOUNT-REPAIR-20261014-001",
    "ManifestPath": "/home/cdjensen94/Projects/ContinuumWiki.NET/secure/evidence/cw-m5-026b-source-account-repair-CW-M5-026B-SOURCE-ACCOUNT-REPAIR-20261014-001/authorization.json",
    "PreflightPath": "/home/cdjensen94/Projects/ContinuumWiki.NET/secure/evidence/cw-m5-026b-source-account-repair-CW-M5-026B-SOURCE-ACCOUNT-REPAIR-20261014-001/preflight.json",
    "ResultPath": "/home/cdjensen94/Projects/ContinuumWiki.NET/secure/evidence/cw-m5-026b-source-account-repair-CW-M5-026B-SOURCE-ACCOUNT-REPAIR-20261014-001/result.json",
    "ConsumedPath": "/home/cdjensen94/Projects/ContinuumWiki.NET/secure/evidence/cw-m5-026b-source-account-repair-CW-M5-026B-SOURCE-ACCOUNT-REPAIR-20261014-001/consumed.json"
  }
}
